{
  "$schema": "https://json-schema.org/draft/2020-12/schema",
  "$id": "https://raw.githubusercontent.com/sofiane-git/shipmate/main/schemas/shipmate-config.schema.json",
  "title": "shipmate config",
  "type": "object",
  "required": ["remote", "protectedBranch", "primaryContract", "contracts"],
  "additionalProperties": false,
  "properties": {
    "$schema": { "type": "string" },
    "remote": { "type": "string", "minLength": 1 },
    "protectedBranch": { "type": "string", "minLength": 1 },
    "primaryContract": { "type": "string", "minLength": 1 },
    "securityReview": { "enum": ["auto", "always", "off"], "default": "auto" },
    "contracts": {
      "type": "array",
      "minItems": 1,
      "items": {
        "type": "object",
        "required": ["name", "tag", "bumpFrom", "locations"],
        "additionalProperties": false,
        "properties": {
          "name": { "type": "string", "pattern": "^[a-z][a-z0-9-]*$" },
          "tag": { "type": ["string", "null"] },
          "bumpFrom": { "enum": ["changelog", "manual"] },
          "locations": {
            "type": "array",
            "minItems": 1,
            "items": {
              "type": "object",
              "required": ["file"],
              "additionalProperties": false,
              "properties": {
                "file": { "type": "string", "minLength": 1 },
                "json": { "type": "string", "minLength": 1 },
                "toml": { "type": "string", "minLength": 1 },
                "regex": { "type": "string", "minLength": 1 }
              },
              "oneOf": [
                { "required": ["json"] },
                { "required": ["toml"] },
                { "required": ["regex"] }
              ]
            }
          }
        }
      }
    }
  }
}
